{
  "format_version": 1,
  "id": "grand-piano",
  "name_zh": "大钢琴",
  "name_en": "Grand Piano",
  "synthesis": "modal",
  "waveform": "triangle",
  "gain_millidb": -5800,
  "attack_ms": 4,
  "decay_ms": 1100,
  "sustain_milli": 180,
  "release_ms": 850,
  "filter_cutoff_hz": 7800,
  "filter_resonance_milli": 140,
  "oscillator_mix_milli": 620,
  "detune_cents": 1,
  "pulse_width_milli": 500,
  "model_parameter_1_milli": 2350,
  "model_parameter_2_milli": 720,
  "vibrato_rate_millihz": 0,
  "vibrato_depth_cents": 0,
  "velocity_curve_milli": 1350,
  "noise_mix_milli": 18,
  "saturation_milli": 300,
  "chorus_send_milli": 50,
  "delay_send_milli": 20,
  "reverb_send_milli": 210
}
