{
  "format_version": 1,
  "id": "synth-pad",
  "name_zh": "合成铺底",
  "name_en": "Synth Pad",
  "synthesis": "additive",
  "waveform": "triangle",
  "gain_millidb": -13800,
  "attack_ms": 620,
  "decay_ms": 900,
  "sustain_milli": 780,
  "release_ms": 2600,
  "filter_cutoff_hz": 4300,
  "filter_resonance_milli": 310,
  "oscillator_mix_milli": 680,
  "detune_cents": 14,
  "pulse_width_milli": 500,
  "model_parameter_1_milli": 6800,
  "model_parameter_2_milli": 540,
  "vibrato_rate_millihz": 2100,
  "vibrato_depth_cents": 7,
  "velocity_curve_milli": 650,
  "noise_mix_milli": 25,
  "saturation_milli": 380,
  "chorus_send_milli": 520,
  "delay_send_milli": 210,
  "reverb_send_milli": 520
}
