{
  "format_version": 1,
  "id": "music-box",
  "name_zh": "音乐盒",
  "name_en": "Music Box",
  "synthesis": "modal",
  "waveform": "sine",
  "gain_millidb": -11600,
  "attack_ms": 1,
  "decay_ms": 1350,
  "sustain_milli": 35,
  "release_ms": 1050,
  "filter_cutoff_hz": 14600,
  "filter_resonance_milli": 110,
  "oscillator_mix_milli": 520,
  "detune_cents": 0,
  "pulse_width_milli": 500,
  "model_parameter_1_milli": 3450,
  "model_parameter_2_milli": 1100,
  "vibrato_rate_millihz": 0,
  "vibrato_depth_cents": 0,
  "velocity_curve_milli": 1260,
  "noise_mix_milli": 8,
  "saturation_milli": 120,
  "chorus_send_milli": 60,
  "delay_send_milli": 110,
  "reverb_send_milli": 440
}
