{
  "format_version": 1,
  "id": "harp",
  "name_zh": "竖琴",
  "name_en": "Harp",
  "synthesis": "pluck",
  "waveform": "triangle",
  "gain_millidb": -9800,
  "attack_ms": 2,
  "decay_ms": 1800,
  "sustain_milli": 70,
  "release_ms": 1250,
  "filter_cutoff_hz": 9400,
  "filter_resonance_milli": 80,
  "oscillator_mix_milli": 390,
  "detune_cents": 0,
  "pulse_width_milli": 500,
  "model_parameter_1_milli": 997,
  "model_parameter_2_milli": 900,
  "vibrato_rate_millihz": 0,
  "vibrato_depth_cents": 0,
  "velocity_curve_milli": 1320,
  "noise_mix_milli": 18,
  "saturation_milli": 160,
  "chorus_send_milli": 45,
  "delay_send_milli": 85,
  "reverb_send_milli": 480
}
