{
  "format_version": 1,
  "id": "synth-bass",
  "name_zh": "合成贝斯",
  "name_en": "Synth Bass",
  "synthesis": "subtractive",
  "waveform": "square",
  "gain_millidb": -12900,
  "attack_ms": 5,
  "decay_ms": 240,
  "sustain_milli": 680,
  "release_ms": 190,
  "filter_cutoff_hz": 1500,
  "filter_resonance_milli": 520,
  "oscillator_mix_milli": 940,
  "detune_cents": -12,
  "pulse_width_milli": 500,
  "model_parameter_1_milli": 850,
  "model_parameter_2_milli": 410,
  "vibrato_rate_millihz": 0,
  "vibrato_depth_cents": 0,
  "velocity_curve_milli": 1200,
  "noise_mix_milli": 8,
  "saturation_milli": 2400,
  "chorus_send_milli": 40,
  "delay_send_milli": 20,
  "reverb_send_milli": 40
}
