{
  "format_version": 1,
  "id": "vibraphone",
  "name_zh": "颤音琴",
  "name_en": "Vibraphone",
  "synthesis": "fm2",
  "waveform": "sine",
  "gain_millidb": -9000,
  "attack_ms": 3,
  "decay_ms": 1650,
  "sustain_milli": 160,
  "release_ms": 1350,
  "filter_cutoff_hz": 11800,
  "filter_resonance_milli": 60,
  "oscillator_mix_milli": 850,
  "detune_cents": 0,
  "pulse_width_milli": 500,
  "model_parameter_1_milli": 4000,
  "model_parameter_2_milli": 5200,
  "vibrato_rate_millihz": 5900,
  "vibrato_depth_cents": 28,
  "velocity_curve_milli": 1180,
  "noise_mix_milli": 2,
  "saturation_milli": 180,
  "chorus_send_milli": 170,
  "delay_send_milli": 90,
  "reverb_send_milli": 330
}
