{
  "format_version": 1,
  "id": "harpsichord",
  "name_zh": "羽管键琴",
  "name_en": "Harpsichord",
  "synthesis": "subtractive",
  "waveform": "pulse",
  "gain_millidb": -9200,
  "attack_ms": 1,
  "decay_ms": 720,
  "sustain_milli": 80,
  "release_ms": 180,
  "filter_cutoff_hz": 11200,
  "filter_resonance_milli": 120,
  "oscillator_mix_milli": 900,
  "detune_cents": 7,
  "pulse_width_milli": 270,
  "model_parameter_1_milli": 700,
  "model_parameter_2_milli": 180,
  "vibrato_rate_millihz": 0,
  "vibrato_depth_cents": 0,
  "velocity_curve_milli": 700,
  "noise_mix_milli": 35,
  "saturation_milli": 280,
  "chorus_send_milli": 20,
  "delay_send_milli": 15,
  "reverb_send_milli": 180
}
