{
  "format_version": 1,
  "id": "steel-guitar",
  "name_zh": "钢弦吉他",
  "name_en": "Steel Guitar",
  "synthesis": "pluck",
  "waveform": "saw",
  "gain_millidb": 2300,
  "attack_ms": 1,
  "decay_ms": 1350,
  "sustain_milli": 90,
  "release_ms": 650,
  "filter_cutoff_hz": 8700,
  "filter_resonance_milli": 130,
  "oscillator_mix_milli": 450,
  "detune_cents": 1,
  "pulse_width_milli": 500,
  "model_parameter_1_milli": 996,
  "model_parameter_2_milli": 820,
  "vibrato_rate_millihz": 0,
  "vibrato_depth_cents": 0,
  "velocity_curve_milli": 1380,
  "noise_mix_milli": 35,
  "saturation_milli": 360,
  "chorus_send_milli": 35,
  "delay_send_milli": 55,
  "reverb_send_milli": 260
}
