{
  "format_version": 1,
  "id": "choir",
  "name_zh": "合唱",
  "name_en": "Choir",
  "synthesis": "formant",
  "waveform": "sine",
  "gain_millidb": -13200,
  "attack_ms": 480,
  "decay_ms": 720,
  "sustain_milli": 840,
  "release_ms": 1900,
  "filter_cutoff_hz": 3600,
  "filter_resonance_milli": 460,
  "oscillator_mix_milli": 760,
  "detune_cents": 9,
  "pulse_width_milli": 500,
  "model_parameter_1_milli": 1100,
  "model_parameter_2_milli": 2700,
  "vibrato_rate_millihz": 3900,
  "vibrato_depth_cents": 6,
  "velocity_curve_milli": 580,
  "noise_mix_milli": 30,
  "saturation_milli": 330,
  "chorus_send_milli": 410,
  "delay_send_milli": 40,
  "reverb_send_milli": 610
}
