{
  "format_version": 1,
  "id": "clarinet",
  "name_zh": "单簧管",
  "name_en": "Clarinet",
  "synthesis": "subtractive",
  "waveform": "square",
  "gain_millidb": -12800,
  "attack_ms": 55,
  "decay_ms": 160,
  "sustain_milli": 900,
  "release_ms": 380,
  "filter_cutoff_hz": 5100,
  "filter_resonance_milli": 330,
  "oscillator_mix_milli": 880,
  "detune_cents": 0,
  "pulse_width_milli": 500,
  "model_parameter_1_milli": 610,
  "model_parameter_2_milli": 290,
  "vibrato_rate_millihz": 4600,
  "vibrato_depth_cents": 8,
  "velocity_curve_milli": 820,
  "noise_mix_milli": 36,
  "saturation_milli": 240,
  "chorus_send_milli": 55,
  "delay_send_milli": 10,
  "reverb_send_milli": 240
}
