{
  "format_version": 1,
  "id": "electric-piano",
  "name_zh": "电钢琴",
  "name_en": "Electric Piano",
  "synthesis": "fm2",
  "waveform": "sine",
  "gain_millidb": -7200,
  "attack_ms": 6,
  "decay_ms": 1250,
  "sustain_milli": 260,
  "release_ms": 900,
  "filter_cutoff_hz": 9200,
  "filter_resonance_milli": 90,
  "oscillator_mix_milli": 760,
  "detune_cents": 0,
  "pulse_width_milli": 500,
  "model_parameter_1_milli": 14000,
  "model_parameter_2_milli": 3100,
  "vibrato_rate_millihz": 4800,
  "vibrato_depth_cents": 3,
  "velocity_curve_milli": 1450,
  "noise_mix_milli": 4,
  "saturation_milli": 420,
  "chorus_send_milli": 260,
  "delay_send_milli": 80,
  "reverb_send_milli": 150
}
