{
  "format_version": 1,
  "id": "cello",
  "name_zh": "大提琴",
  "name_en": "Cello",
  "synthesis": "subtractive",
  "waveform": "saw",
  "gain_millidb": -10900,
  "attack_ms": 105,
  "decay_ms": 310,
  "sustain_milli": 850,
  "release_ms": 950,
  "filter_cutoff_hz": 3900,
  "filter_resonance_milli": 260,
  "oscillator_mix_milli": 900,
  "detune_cents": 6,
  "pulse_width_milli": 500,
  "model_parameter_1_milli": 760,
  "model_parameter_2_milli": 510,
  "vibrato_rate_millihz": 5100,
  "vibrato_depth_cents": 15,
  "velocity_curve_milli": 900,
  "noise_mix_milli": 24,
  "saturation_milli": 680,
  "chorus_send_milli": 120,
  "delay_send_milli": 10,
  "reverb_send_milli": 360
}
