{
  "format_version": 1,
  "id": "synth-lead",
  "name_zh": "合成主音",
  "name_en": "Synth Lead",
  "synthesis": "subtractive",
  "waveform": "pulse",
  "gain_millidb": -11800,
  "attack_ms": 8,
  "decay_ms": 140,
  "sustain_milli": 760,
  "release_ms": 260,
  "filter_cutoff_hz": 7200,
  "filter_resonance_milli": 620,
  "oscillator_mix_milli": 920,
  "detune_cents": 11,
  "pulse_width_milli": 360,
  "model_parameter_1_milli": 1250,
  "model_parameter_2_milli": 650,
  "vibrato_rate_millihz": 6100,
  "vibrato_depth_cents": 22,
  "velocity_curve_milli": 1120,
  "noise_mix_milli": 12,
  "saturation_milli": 1850,
  "chorus_send_milli": 190,
  "delay_send_milli": 240,
  "reverb_send_milli": 120
}
