{
  "format_version": 1,
  "id": "nylon-guitar",
  "name_zh": "尼龙弦吉他",
  "name_en": "Nylon Guitar",
  "synthesis": "pluck",
  "waveform": "triangle",
  "gain_millidb": 4000,
  "attack_ms": 2,
  "decay_ms": 1050,
  "sustain_milli": 100,
  "release_ms": 520,
  "filter_cutoff_hz": 5100,
  "filter_resonance_milli": 100,
  "oscillator_mix_milli": 370,
  "detune_cents": 0,
  "pulse_width_milli": 500,
  "model_parameter_1_milli": 991,
  "model_parameter_2_milli": 650,
  "vibrato_rate_millihz": 0,
  "vibrato_depth_cents": 0,
  "velocity_curve_milli": 1250,
  "noise_mix_milli": 22,
  "saturation_milli": 240,
  "chorus_send_milli": 30,
  "delay_send_milli": 20,
  "reverb_send_milli": 230
}
