{
  "format_version": 1,
  "id": "church-organ",
  "name_zh": "教堂风琴",
  "name_en": "Church Organ",
  "synthesis": "additive",
  "waveform": "sine",
  "gain_millidb": -11200,
  "attack_ms": 45,
  "decay_ms": 180,
  "sustain_milli": 920,
  "release_ms": 1200,
  "filter_cutoff_hz": 6800,
  "filter_resonance_milli": 80,
  "oscillator_mix_milli": 820,
  "detune_cents": 2,
  "pulse_width_milli": 500,
  "model_parameter_1_milli": 8000,
  "model_parameter_2_milli": 620,
  "vibrato_rate_millihz": 5200,
  "vibrato_depth_cents": 5,
  "velocity_curve_milli": 520,
  "noise_mix_milli": 0,
  "saturation_milli": 220,
  "chorus_send_milli": 140,
  "delay_send_milli": 20,
  "reverb_send_milli": 480
}
