{
  "format_version": 1,
  "id": "jazz-organ",
  "name_zh": "爵士风琴",
  "name_en": "Jazz Organ",
  "synthesis": "additive",
  "waveform": "square",
  "gain_millidb": -10400,
  "attack_ms": 18,
  "decay_ms": 90,
  "sustain_milli": 950,
  "release_ms": 340,
  "filter_cutoff_hz": 5600,
  "filter_resonance_milli": 190,
  "oscillator_mix_milli": 720,
  "detune_cents": 5,
  "pulse_width_milli": 500,
  "model_parameter_1_milli": 5600,
  "model_parameter_2_milli": 760,
  "vibrato_rate_millihz": 6300,
  "vibrato_depth_cents": 9,
  "velocity_curve_milli": 600,
  "noise_mix_milli": 0,
  "saturation_milli": 1150,
  "chorus_send_milli": 250,
  "delay_send_milli": 30,
  "reverb_send_milli": 170
}
